{
  "$schema": "https://json-schema.org/draft/2020-12/schema",
  "$id": "https://example.invalid/anki-importer/import-request.schema.json",
  "title": "Anki Import Request",
  "type": "object",
  "additionalProperties": false,
  "required": ["deck", "cards"],
  "properties": {
    "deck": {
      "type": "string",
      "minLength": 1
    },
    "model": {
      "type": "string",
      "default": "Basic"
    },
    "frontField": {
      "type": "string",
      "default": "Front"
    },
    "backField": {
      "type": "string",
      "default": "Back"
    },
    "cards": {
      "type": "array",
      "minItems": 1,
      "items": {
        "type": "object",
        "additionalProperties": false,
        "required": ["front", "back"],
        "properties": {
          "front": { "type": "string", "minLength": 1 },
          "back": { "type": "string", "minLength": 1 },
          "tags": {
            "type": "array",
            "items": { "type": "string" },
            "uniqueItems": true
          }
        }
      }
    }
  }
}
